{
  "schema_version": 1,
  "request_id": "00000000-0000-4000-8000-000000000001",
  "booking_url": "https://app.arketa.co/iframe/example/calendar/checkout/FAKE_CHECKOUT_ID",
  "expected_class": {
    "name": "Synthetic Reformer Class",
    "date": "2030-01-02",
    "start_time": "09:30",
    "timezone": "America/Los_Angeles"
  },
  "reserve_for": "myself",
  "permitted_actions": ["book", "waitlist"],
  "policy_version": "2030-01-01",
  "allow_monetary_charge": false,
  "dry_run": true
}
